{
  "schema_version": "1.0",
  "is_demo": true,
  "method": "synthetic_A",
  "dataset": {
    "version": "synthetic",
    "protocol": "synthetic",
    "variant": "synthetic",
    "split": "test",
    "path": "eval/examples/synthetic_input.json",
    "sha256": "a9600904df8ea0656bfdba2b8faa58ad476ea4d9682caedf6c98dd1a263efb29",
    "n_samples": 8
  },
  "seed": 42,
  "config": {
    "model": "none; manually specified synthetic scores",
    "bootstrap_repetitions_for_demo": 50
  },
  "decision_rule": {
    "score_direction": "higher_means_attack",
    "operator": ">=",
    "threshold": 0.5,
    "source": "synthetic_demo"
  },
  "metrics": {
    "curves": {
      "status": "ok",
      "roc_auc": 0.875,
      "average_precision": 0.9166666666666666,
      "roc": {
        "fpr": [
          0.0,
          0.0,
          0.0,
          0.0,
          0.25,
          0.5,
          0.5,
          0.75,
          1.0
        ],
        "tpr": [
          0.0,
          0.25,
          0.5,
          0.75,
          0.75,
          0.75,
          1.0,
          1.0,
          1.0
        ],
        "thresholds": [
          null,
          0.9,
          0.8,
          0.7,
          0.6,
          0.4,
          0.35,
          0.2,
          0.1
        ]
      },
      "pr": {
        "precision": [
          0.5,
          0.5714285714285714,
          0.6666666666666666,
          0.6,
          0.75,
          1.0,
          1.0,
          1.0,
          1.0
        ],
        "recall": [
          1.0,
          1.0,
          1.0,
          0.75,
          0.75,
          0.75,
          0.5,
          0.25,
          0.0
        ],
        "thresholds": [
          0.1,
          0.2,
          0.35,
          0.4,
          0.6,
          0.7,
          0.8,
          0.9
        ]
      }
    },
    "classification": {
      "status": "ok",
      "n_samples": 8,
      "n_negative": 4,
      "n_positive": 4,
      "accuracy": 0.75,
      "macro_f1": 0.75,
      "macro_f1_convention": "fixed_labels_0_1_zero_division_0",
      "both_true_classes_present": true,
      "confusion_matrix": {
        "tn": 3,
        "fp": 1,
        "fn": 1,
        "tp": 3
      },
      "tpr": 0.75,
      "fpr": 0.25,
      "precision": 0.75,
      "attempted": {
        "status": "ok",
        "support": 1,
        "false_positives": 0,
        "fpr": 0.0
      }
    },
    "operating_points": {
      "status": "ok",
      "protocol": "empirical_roc",
      "operating_points": [
        {
          "target_fpr": 0.001,
          "actual_fpr": 0.0,
          "tpr": 0.75,
          "threshold": 0.7,
          "threshold_kind": "finite"
        },
        {
          "target_fpr": 0.01,
          "actual_fpr": 0.0,
          "tpr": 0.75,
          "threshold": 0.7,
          "threshold_kind": "finite"
        },
        {
          "target_fpr": 0.05,
          "actual_fpr": 0.0,
          "tpr": 0.75,
          "threshold": 0.7,
          "threshold_kind": "finite"
        }
      ]
    },
    "per_class": {
      "status": "ok",
      "classes": [
        {
          "attack_family": "ddos",
          "support": 2,
          "detected": 1,
          "recall": 0.5
        },
        {
          "attack_family": "botnet",
          "support": 2,
          "detected": 2,
          "recall": 1.0
        },
        {
          "attack_family": "heartbleed",
          "support": 0,
          "detected": 0,
          "recall": null
        }
      ]
    }
  },
  "cost": {
    "training_seconds": null,
    "training_time_note": "No model was trained; synthetic demo only.",
    "hardware": "Windows / AMD64 / AMD64 Family 25 Model 117 Stepping 2, AuthenticAMD",
    "thread_settings": {
      "supported_blas_openmp_limit": 1,
      "framework": "NumPy toy scorer only"
    },
    "inference": {
      "status": "ok",
      "device": "cpu",
      "scope": "prepared_batch_to_numpy_scores",
      "batch_size": 4,
      "warmup": 2,
      "repeats": 5,
      "threadpool_limit": 1,
      "median_batch_ms": 0.0007,
      "amortized_ms_per_flow": 0.000175,
      "throughput_flows_per_second": 5714285.714285715,
      "batch_times_ms": [
        0.0012,
        0.0011,
        0.0007,
        0.0005,
        0.0005
      ]
    }
  },
  "daily_alerts": {
    "assumed_benign_flows": 100000,
    "assumed_attack_flows": 100,
    "fpr": 0.25,
    "tpr": 0.75,
    "expected_false_alerts": 25000.0,
    "expected_true_alerts": 75.0,
    "expected_total_alerts": 25075.0
  },
  "comparisons": [
    {
      "method_a": "synthetic_A",
      "method_b": "synthetic_B",
      "seed_a": 42,
      "seed_b": 42,
      "result": {
        "status": "ok",
        "metric": "ap",
        "target_fpr": null,
        "difference_definition": "A_minus_B",
        "value_a": 0.9166666666666666,
        "value_b": 1.0,
        "difference": -0.08333333333333337,
        "ci_lower": -0.25,
        "ci_upper": 0.0,
        "confidence": 0.95,
        "n_bootstrap": 50,
        "seed": 42,
        "resampling": "paired_class_stratified_rows",
        "interval_method": "percentile",
        "n_samples": 8,
        "n_negative": 4,
        "n_positive": 4
      }
    },
    {
      "method_a": "synthetic_A",
      "method_b": "synthetic_B",
      "seed_a": 42,
      "seed_b": 42,
      "result": {
        "status": "ok",
        "metric": "tpr_at_fpr",
        "target_fpr": 0.01,
        "difference_definition": "A_minus_B",
        "value_a": 0.75,
        "value_b": 1.0,
        "difference": -0.25,
        "ci_lower": -0.75,
        "ci_upper": 0.0,
        "confidence": 0.95,
        "n_bootstrap": 50,
        "seed": 42,
        "resampling": "paired_class_stratified_rows",
        "interval_method": "percentile",
        "n_samples": 8,
        "n_negative": 4,
        "n_positive": 4
      }
    }
  ],
  "provenance": {
    "code_commit": "9df4ccec95c66c4237494b855caa7f1770fd80da",
    "created_at": "2026-10-29T06:58:51.214039+00:00",
    "software": {
      "python": "3.13.10",
      "numpy": "2.3.5",
      "scikit-learn": "1.8.0",
      "jsonschema": "4.26.0",
      "threadpoolctl": "3.7.0"
    },
    "notes": "SYNTHETIC DEMO ONLY. Timings describe array copying, not a trained detector. Daily volumes are hypothetical. The Git commit may exclude uncommitted files; current file hashes: {\"demo.py\": \"52299d5900ba4376b36c9ee34e8af4ec54eebd563d29604ef48a97a6c75c5234\", \"metrics.py\": \"aa593a22c51ad4d657c2c09716b103fe921c3c7f5c51cb597bd866094fefcd97\", \"schema.json\": \"51348909a1c43741c25d4381ab7cd384c076f27df89570ef144c70f5ba6ae28c\"}"
  }
}
